Category,Title,Brand,Price (INR),Rating,Review Count,Product Badge,Product URL,Image URL,Delivery Info,Discount
laptop,"HP Pavilion x360, 13th Gen Intel Core i5-1335U (16GB DDR4, 512GB SSD) FHD, IPS, Micro-Edge, 14""/35.6cm, Touchscreen 2-in-1, Win11, Office21, Silver, 1.51kg, ek1074TU, Iris Xe, FPR, 5MP Camera Laptop",,,3.8 out of 5 stars,169,,,https://m.media-amazon.com/images/I/618zAXbM4uL._AC_UY218_.jpg,,
laptop,"HP 15, AMD Ryzen 3 7320U (8GB LPDDR5, 512GB SSD) FHD, Anti-Glare, Micro-Edge, 15.6""/39.6cm, Win 11, Office 21, Silver, 1.59kg, fc0154AU, AMD Radeon Graphics, 1080p FHD Camera Laptop",,,4.0 out of 5 stars,"1,653",,,https://m.media-amazon.com/images/I/61SHFVKs+AL._AC_UY218_.jpg,,
laptop,"HP 15, 13th Gen Intel Core i3-1315U (12GB DDR4, 512GB SSD) FHD, Anti-Glare, Micro-Edge, 15.6''/39.6cm, Win11, M365 Basic(1yr)* Office24, Silver, 1.59kg, fd0573TU, FHD Camera w/Shutter, Backlit Laptop",,,3.7 out of 5 stars,147,,,https://m.media-amazon.com/images/I/71FXHAM+jWL._AC_UY218_.jpg,,
laptop,"Acer [SmartChoice Aspire Lite AMD Ryzen 5-5625U Processor, 16 GB/512 GB, Full HD, 15.6""/39.62 cm, Windows 11 Home, Steel Gray, 1.59 kg, AL15-41, Metal Body, Thin and Light Laptop",,,3.9 out of 5 stars,"1,270",,,https://m.media-amazon.com/images/I/61k0gpxQwCL._AC_UY218_.jpg,,
laptop,"Acer Aspire Lite, 13th Gen, Intel Core i3-1305U, 8GB RAM, 512GB SSD, Full HD, 15.6""/39.62cm, Windows 11 Home, Steel Gray, 1.59KG, AL15-53, Metal Body, 36 WHR, Thin and Light Premium Laptop",,,3.9 out of 5 stars,336,,,https://m.media-amazon.com/images/I/71o7b6YJMfL._AC_UY218_.jpg,,
laptop,"Apple MacBook Air Laptop: Apple M1 chip, 13.3-inch/33.74 cm Retina Display, 8GB RAM, 256GB SSD Storage, Backlit Keyboard, FaceTime HD Camera, Touch ID. Works with iPhone/iPad; Space Grey",,,4.6 out of 5 stars,"7,004",,,https://m.media-amazon.com/images/I/71jG+e7roXL._AC_UY218_.jpg,,
laptop,"Dell Inspiron 3530 Laptop, 13th Gen Intel Core i5-1334U Processor, 16GB, 512GB SSD, 15.6""(39.62cm) FHD 120Hz 250 nits, Backlit KB, Windows 11 + MSO'24 & 15 Month McAfee, Silver, Thin & Light- 1.62kg",,,3.8 out of 5 stars,69,,,https://m.media-amazon.com/images/I/81RQ0bjUo1L._AC_UY218_.jpg,,
laptop,"Lenovo Smartchoice LOQ, Intel Core i5-12450HX, 12th Gen, RTX 3050-6GB, 16GB RAM, 512GB SSD, FHD 144Hz 300Nits, 15.6""/39.6cm, Windows 11, MS Office 21, Grey, 2.4Kg, 83GS003UIN, Gaming Laptop",,,4.0 out of 5 stars,612,,,https://m.media-amazon.com/images/I/81tmCrtiRgL._AC_UY218_.jpg,,
laptop,"HP 15, AMD Ryzen 5 7520U, 16GB DDR5, 512GB SSD, (Win 11, Office 21, Silver, 1.59kg), Anti-Glare, Micro-Edge, 15.6-inch(39.6cm), FHD Laptop, AMD Radeon Graphics, 1080p FHD Camera, Backlit KB, fc0156AU",,,3.4 out of 5 stars,72,,,https://m.media-amazon.com/images/I/615YseEDBqL._AC_UY218_.jpg,,
laptop,HP 255 G10 ‎‎Laptop (AMD Athlon Silver 7120U/ 8GB RAM / 256GB SSD/Windows 11/15.6 INCH ASH Silver,,,3.8 out of 5 stars,33,,,https://m.media-amazon.com/images/I/71rw7cd14mL._AC_UY218_.jpg,,
laptop,"HP Smartchoice Victus, AMD Ryzen 5 8645HS, 6GB RTX 3050, 31 TOPS, Upgrade (Upto 32GB) 16GB DDR5, 512GB SSD, FHD, 144Hz,IPS, 15.6""/39.6cm, Win11, M365* Office24, Blue, 2.3kg, fb3009AX, AI Gaming Laptop",,,3.4 out of 5 stars,21,,,https://m.media-amazon.com/images/I/71X+a0NItZL._AC_UY218_.jpg,,
laptop,"HP Professional 15, 12th Gen Intel Core Celeron-N4500 Turbo Boost, 8GB DDR4, 256GB SSD, (Win 11 Pro, MSO 21Pro, Gray, 1.59kg), 15.6 inch, UHD Graphics, Numeric KB, Business Laptop",,,4.8 out of 5 stars,9,,,https://m.media-amazon.com/images/I/61Qh9Vy+LwL._AC_UY218_.jpg,,
laptop,"Lenovo {SmartChoice)Chromebook Intel Celeron N4500 (4GB RAM/64GB eMMC 5.1/11.6 Inch (29.46cm)/HD Display/2Wx2 Stereo Speakers/HD Camera/Chrome OS/Blue/1.21Kg), 82UY0014HA",,,3.8 out of 5 stars,10,,,https://m.media-amazon.com/images/I/71eHrg3+O7L._AC_UY218_.jpg,,
laptop,"Lenovo ThinkBook 16 AMD Ryzen 5 7535HS (16GB RAM/512GB SSD/Win 11 Home/Office 2024/Backlit Keyboard/Fingerprint) 16"" WUXGA IPS 300 Nits Thin & Light Laptop/1Y Warranty/Aluminium Top/1.7kg, 21MWA0BSIN",,,3.7 out of 5 stars,4,,,https://m.media-amazon.com/images/I/51XpiWaeMQL._AC_UY218_.jpg,,
laptop,"ASUS Vivobook 15, Intel Core i3-1315U 13th Gen, 15.6"" (39.62 cms) FHD, Thin and Light Laptop (8GB RAM/512GB SSD/Win11/MS Office/Backlit Keyboard/Silver/1.7 kg), X1504VA-NJ320WS",,,4.2 out of 5 stars,35,,,https://m.media-amazon.com/images/I/715P4YWFq7L._AC_UY218_.jpg,,
laptop,"Lenovo IdeaPad Slim 3, Intel Core i5-12450H, 12th Gen, 16GB RAM, 512GB SSD, FHD, 14""/35.5cm, Windows 11, MS Office Home 2024, Grey, 1.37Kg, 83EQ0072IN, Alexa Built-in, 3 mon. Game Pass Laptop",,,3.9 out of 5 stars,609,,,https://m.media-amazon.com/images/I/81Tj8G57-WL._AC_UY218_.jpg,,
laptop,"HP 15, 13th Gen Intel Core i5-1335U (16GB DDR4, 512GB SSD) FHD, Anti-Glare, Micro-Edge, 15.6''/39.6cm, Win11, M365 Basic(1yr)* Office24, Silver,1.59kg, fd0577TU, Iris Xe, FHD Camera w/Shutter Laptop",,,3.8 out of 5 stars,26,,,https://m.media-amazon.com/images/I/71bagLp2sXL._AC_UY218_.jpg,,
laptop,"ASUS Vivobook Go 14, AMD Ryzen 5 7520U,Thin & Light Laptop (AMD Radeon iGPU/16GB RAM/512GB SSD/FHD/14/60Hz/42WHrs/Windows 11/M365 Basic (1Year)*/Office Home 2024/Mixed Black/1.38 kg) E1404FA-NK5542WS",,,3.9 out of 5 stars,26,,,https://m.media-amazon.com/images/I/71Svo3YjmHL._AC_UY218_.jpg,"Thu, 17 Jul",
laptop,"Acer Aspire 3, Intel Core Celeron N4500, 8GB LPDDR4X, 512GB SSD, HD, 14""/35.56cm, Windows 11 Home, Pure Silver, 1.3KG, A324-45, HD Webcam, 38 WHR Laptop",,,3.4 out of 5 stars,406,,,https://m.media-amazon.com/images/I/61Y8j1QN5YL._AC_UY218_.jpg,"Fri, 18 Jul",
laptop,"Acer Aspire Lite, AMD Ryzen 3 7330U Processor, 8 GB RAM, 512 GB SSD, Full HD, 15.6""/39.62cm, Windows 11 Home, Steel Gray, 1.6KG, AL15-41, Metal Body, Premium Thin and Light Laptop",,,3.9 out of 5 stars,"1,270",,,https://m.media-amazon.com/images/I/61keRkmSGBL._AC_UY218_.jpg,,
laptop,"Lenovo Smartchoice LOQ, Intel Core i5-12450HX, 12th Gen, RTX 3050-6GB, 16GB RAM, 512GB SSD, FHD 144Hz 300Nits, 15.6""/39.6cm, Windows 11, MS Office 21, Grey, 2.4Kg, 83GS003UIN, Gaming Laptop",,,4.0 out of 5 stars,612,,,https://m.media-amazon.com/images/I/81tmCrtiRgL._AC_UY218_.jpg,,
laptop,"HP 15, 13th Gen Intel Core i3-1315U Laptop (8GB DDR4,512GB SSD) Anti-Glare, Micro-Edge,15.6''/39.6cm, FHD, Win11,M365 Basic(1yr),Office Home24, Silver,1.59kg, FHD Camera w/Privacy Shutter, fd0569TU",,,4.1 out of 5 stars,"2,012",,,https://m.media-amazon.com/images/I/71K2w4+A7UL._AC_UY218_.jpg,"Fri, 18 Jul",
laptop,"Acer Aspire Lite, AMD Ryzen 3 7330U Processor, 16 GB RAM, 512GB SSD, Full HD, 15.6""/39.62cm, Windows 11 Home, Steel Gray, 1.59KG, AL15-41, Metal Body, Premium Thin and Light Laptop",,,3.9 out of 5 stars,"1,270",,,https://m.media-amazon.com/images/I/513p8BwV-RL._AC_UY218_.jpg,,
laptop,"Lenovo V15 G4 AMD Ryzen 5 7520U 15.6 inch FHD Thin & Lite Laptop, AMD Graphics, 16GB DDR5 5500Mhz Ram, 512GB SSD NVMe, Windows 11, Dolby Audio, Arctic Grey, 1 Year Onsite Brand Warranty",,,4.1 out of 5 stars,82,,,https://m.media-amazon.com/images/I/51bfKFtNSQL._AC_UY218_.jpg,"Wed, 16 Jul",
laptop,STRIFF Adjustable Laptop Tabletop Stand Patented Riser Ventilated Portable Foldable Compatible with MacBook Notebook Tablet Tray Desk Table Book with Free Phone Stand (Black),,,4.3 out of 5 stars,"39,828",,,https://m.media-amazon.com/images/I/71Zf9uUp+GL._AC_UY218_.jpg,,
laptop,"JioBook 11 with Lifetime Office/Android 4G Laptop Mediatek 8788 (JioOS) / Octa-core/ 4GB RAM / 64 eMMC Storage/Thin and Light Laptop (11.6 inch, 990 Grams)/ Dual Band WiFi + SIM/Blue",,,3.0 out of 5 stars,403,,,https://m.media-amazon.com/images/I/61IDcxw27+L._AC_UY218_.jpg,,
laptop,"Lenovo IdeaPad Slim 3, Intel Core i5-12450H, 12th Gen, 16GB RAM, 512GB SSD, FHD, 14""/35.5cm, Windows 11, MS Office Home 2024, Grey, 1.37Kg, 83EQ0072IN, Alexa Built-in, 3 mon. Game Pass Laptop",,,3.9 out of 5 stars,609,,,https://m.media-amazon.com/images/I/81Tj8G57-WL._AC_UY218_.jpg,,
laptop,"ASUS Vivobook 15,13th Gen,Intel Core i5-13420H(Intel UHD iGPU/16GB RAM/512GB SSD/FHD/15.6""/60Hz/Backlit Keyboard/Windows 11/M365 Basic (1Year)*/Office Home 2024/Quiet Blue/1.70 kg) X1502VA-BQ836WS",,,3.8 out of 5 stars,58,,,https://m.media-amazon.com/images/I/71CgmbyKMFL._AC_UY218_.jpg,,
laptop,"HP 15, 13th Gen Intel Core i5-1334U Laptop(16GB DDR4, 512GB SSD), 15.6""/39.6cm,FHD,Win 11,Office 24,Microsoft 365*, Silver,1.59kg, Iris Xe Graphics, FHD Camera w/Privacy Shutter, Backlit KB, fd0467tu",,,3.3 out of 5 stars,33,,,https://m.media-amazon.com/images/I/71bagLp2sXL._AC_UY218_.jpg,,
laptop,"HP 15, 13th Gen Intel Core i3-1315U Laptop (8GB DDR4, 512GB SSD) Anti-Glare, Micro-Edge, 15.6""/39.6cm, FHD, Win 11, MSO 21, Silver, 1.59kg, Intel UHD Graphics, 1080p FHD Camera, 15-fd0006TU/fd0186tu",,,3.7 out of 5 stars,147,,,https://m.media-amazon.com/images/I/718ba2SBJYL._AC_UY218_.jpg,,
laptop,"ASUS TUF Gaming A15, 15.6"" (39.62cm) FHD 16:9 144Hz, AMD Ryzen 7 7435HS, Gaming Laptop (16 DDR5/512GB SSD/NVIDIA GeForce RTX 2050/Windows 11 Home/Graphite Black/2.30 Kg), FA506NFR-HN045W",,,3.9 out of 5 stars,351,,,https://m.media-amazon.com/images/I/61xBASwU+zL._AC_UY218_.jpg,,
laptop,"HP 15, 13th Gen Intel Core i5-1335U (16GB DDR4, 512GB SSD) FHD, Anti-Glare, Micro-Edge, 15.6''/39.6cm, Win11, M365 Basic(1yr)* Office24, Silver,1.59kg, fd0577TU, Iris Xe, FHD Camera w/Shutter Laptop",,,3.8 out of 5 stars,26,,,https://m.media-amazon.com/images/I/71bagLp2sXL._AC_UY218_.jpg,,
laptop,"Lenovo Ideapad 1 AMD Ryzen 5 5625U (16GB RAM/512GB SSD/Windows 11/Office Home 2024/15.6 Inch (39.6Cm)/FHD IPS Display/3Months Game Pass/Grey/1.6Kg), 82R4011CIN/0DIN Laptop",,,4.1 out of 5 stars,"2,057",,,https://m.media-amazon.com/images/I/814By4kEe5L._AC_UY218_.jpg,,
laptop,"Lenovo V15 Intel Celeron N4500 15.6"" (39.62 cm) FHD (1920x1080) Antiglare 250 Nits Thin and Light Laptop (8GB RAM/256GB SSD/Windows 11 Home/Black/1Y Onsite/1.7 kg), 82QYA00MIN",,,3.9 out of 5 stars,523,,,https://m.media-amazon.com/images/I/516btukUorL._AC_UY218_.jpg,"Wed, 16 Jul",
laptop,"Lenovo Smartchoice LOQ AMD Ryzen 5 7235HS | NVIDIA RTX 3050 6GB (24GB RAM/512GB SSD/15.6"" (39.6cm)/Windows 11/Office Home 2024/100% sRGB/3 Mon. Game Pass/Grey/2.4Kg), 83JC00EFIN Gaming Laptop",,,4.1 out of 5 stars,102,,,https://m.media-amazon.com/images/I/61Ol4v72-NL._AC_UY218_.jpg,,
laptop,ULTIMUS APEX Laptop Intel Celeron Dual Core 8 GB LPDDR4 512 GB SSD Expandable~1TB 14.1 FHD IPS Laptop Anti-Glare Ultra Thin Bezel 180° Hinge 3.0x3 USB HDMI SD Card Slot Win 11 Home 1.25KG Silver,,,3.6 out of 5 stars,8,,,https://m.media-amazon.com/images/I/713QmwFZbsL._AC_UY218_.jpg,,
laptop,"Lenovo IdeaPad Slim 3 12th Gen Intel® Core™ i5-12450H 15.6 inch (39.6cm) FHD Laptop (16GB/512GB SSD/Windows 11/Office 2024/Alexa Built-in/1Yr ADP Free/3 Month Game Pass/Arctic Grey/1.62Kg), 83ER00KPIN",,,3.9 out of 5 stars,261,,,https://m.media-amazon.com/images/I/61TRKPzWmBL._AC_UY218_.jpg,,
laptop,"CHUWI CoreBook X Pro Laptop 12thGen i5-12450H Processor 15.6"" Laptop with 16GB DDR4 RAM and 512GB SSD, FHD Display, Backlit Keyboard, Windows 11, Gray, 3xUSB3.0,1xHDMI,SD Card Slot,3.5MM,Camera Switch",,,3.6 out of 5 stars,133,,,https://m.media-amazon.com/images/I/81NZl5AXsiL._AC_UY218_.jpg,,
laptop,"Lenovo IdeaPad Slim 3, Intel Core i5-12450H, 12th Gen, 16GB RAM, 512GB SSD, FHD, 14""/35.5cm, Windows 11, MS Office Home 2024, Grey, 1.37Kg, 83EQ0072IN, Alexa Built-in, 3 mon. Game Pass Laptop",,,3.9 out of 5 stars,609,,,https://m.media-amazon.com/images/I/81Tj8G57-WL._AC_UY218_.jpg,,
laptop,"Dell Inspiron 3530 Laptop, 13th Gen Intel Core i5-1334U Processor, 16GB, 512GB SSD, 15.6""(39.62cm) FHD 120Hz 250 nits, Backlit KB, Windows 11 + MSO'24 & 15 Month McAfee, Silver, Thin & Light- 1.62kg",,,3.8 out of 5 stars,69,,,https://m.media-amazon.com/images/I/81RQ0bjUo1L._AC_UY218_.jpg,,
laptop,"Lenovo V15 AMD Ryzen 3 7320U 15.6"" (39.62cm) FHD 250 Nits Antiglare Thin and Light Laptop (8GB/512GB SSD/Windows 11 Home/Arctic Grey/1.63 Kg), 83CQ000XIN",,,3.7 out of 5 stars,73,,,https://m.media-amazon.com/images/I/41kIqmz4S3L._AC_UY218_.jpg,,
laptop,"HP 15, Intel Ultra 5 125H, 12 Tops (16GB DDR5, 512GB SSD) FHD, IPS, 15.6''/39.6cm, Win11, M365 Basic(1yr)* Office24, Silver, 1.65kg, fd1254TU, Intel Graphics, FHD Camera w/Shutter, AI Powered Laptop",,,3.0 out of 5 stars,21,,,https://m.media-amazon.com/images/I/810GYUCY+aL._AC_UY218_.jpg,,
laptop,"HP 15, 13th Gen Intel Core i5-1335U (16GB DDR4, 512GB SSD) FHD, Anti-Glare, Micro-Edge, 15.6''/39.6cm, Win11, M365 Basic(1yr)* Office24, Silver,1.59kg, fd0577TU, Iris Xe, FHD Camera w/Shutter Laptop",,,3.8 out of 5 stars,26,,,https://m.media-amazon.com/images/I/71bagLp2sXL._AC_UY218_.jpg,,
laptop,"HP 15s, AMD Ryzen 5 5500U (8GB DDR4, 512GB SSD) FHD, Anti-Glare, 15.6''/39.6 cm, Win 11, Office 21, Silver, 1.69 kg, eq2144AU, AMD Radeon Graphics, HD Camera, Dual Speakers Laptop",,,4.0 out of 5 stars,"1,128",,,https://m.media-amazon.com/images/I/71-I1PNzLSL._AC_UY218_.jpg,Alexa Built-in,
laptop,"Apple 2025 MacBook Air (13-inch, Apple M4 chip with 10-core CPU and 8-core GPU, 16GB Unified Memory, 256GB) - Midnight",,,4.8 out of 5 stars,29,,,https://m.media-amazon.com/images/I/71CjP9jmqZL._AC_UY218_.jpg,,
laptop,ULTIMUS APEX Laptop Intel Celeron Dual Core 8 GB LPDDR4 512 GB SSD Expandable~1TB 14.1 FHD IPS Laptop Anti-Glare Ultra Thin Bezel 180° Hinge 3.0x3 USB HDMI SD Card Slot Win 11 Home 1.25KG Silver,,,3.6 out of 5 stars,8,,,https://m.media-amazon.com/images/I/713QmwFZbsL._AC_UY218_.jpg,,
laptop,"HP 15 Laptop,13th Gen Intel Core i7-1355U Laptop(16GB DDR4,512GB SSD) Anti-Glare, Micro-Edge,15.6"" FHD, Win11, M365 Basic(1yr),MSOffice 2024,Silver,1.59kg, Iris Xe, Camera w/Shutter,FPR, fd0515TU",,,5.0 out of 5 stars,7,,,https://m.media-amazon.com/images/I/71+mpbHMDgL._AC_UY218_.jpg,,
laptop,"Dyazo 6 Angles Adjustable Aluminum Ergonomic Foldable Portable Tabletop Laptop/Desktop Riser Stand Holder Compatible for MacBook, HP, Dell, Lenovo & All Other Notebook (Silver)",,,4.3 out of 5 stars,"14,963",,,https://m.media-amazon.com/images/I/61kBmC8NfGL._AC_UY218_.jpg,,
laptop,"HP 15, 13th Gen Intel Core i5-1335U (16GB DDR4, 512GB SSD) FHD, Anti-Glare, Micro-Edge, 15.6''/39.6cm, Win11, M365 Basic(1yr)* Office24, Silver,1.59kg, fd0577TU, Iris Xe, FHD Camera w/Shutter Laptop",,,3.8 out of 5 stars,26,,,https://m.media-amazon.com/images/I/71bagLp2sXL._AC_UY218_.jpg,,
laptop,"ASUS Vivobook 15,13th Gen,Intel Core i5-13420H(Intel UHD iGPU/16GB RAM/512GB SSD/FHD/15.6""/60Hz/Backlit Keyboard/Windows 11/M365 Basic (1Year)*/Office Home 2024/Quiet Blue/1.70 kg) X1502VA-BQ836WS",,,3.8 out of 5 stars,58,,,https://m.media-amazon.com/images/I/71CgmbyKMFL._AC_UY218_.jpg,,
laptop,"Lenovo Smartchoice Ideapad Slim 3 13Th Gen Intel Core I7-13620H 15.3 Inch(38.8Cm) WUXGA IPS Laptop(16GB RAM/512GB SSD/Windows 11/Office Home 2024/Backlit Keyboard/1Yr ADP Free/Grey/1.6Kg),83K100CJIN",,,3.8 out of 5 stars,42,,,https://m.media-amazon.com/images/I/71HMPbAf-iL._AC_UY218_.jpg,,
laptop,"HP Smartchoice Omen AMD Ryzen 7 7840Hs, 8GB RTX 4060 (16GB DDR5, 1TB SSD) FHD, 165Hz, 300Nits, IPS, 16.1''/40.9cm, Win11, Office 21, Black, 2.32kg, Xd0020ax, RGB kb, Tempest Cooling, AI Gaming Laptop",,,4.0 out of 5 stars,228,,,https://m.media-amazon.com/images/I/715WLPCIrIL._AC_UY218_.jpg,,
laptop,"Walker Best Student &Office Work Laptop|Thin & Light|14.1"" 1920 * 1080 Resolution FHD IPS Display |4GB RAM,128GB SSD|Celeron Processor N4020 (Gemini Lake)| Windows 11 Home | Silver",,,3.4 out of 5 stars,135,,,https://m.media-amazon.com/images/I/61zWFTCfWeL._AC_UY218_.jpg,,
laptop,"HP 15 (2025), Intel Celeron Dual Core N4500 - (8 GB/256 GB SSD/Intel UHD Graphics/Windows 11 Pro) Thin and Light Business Laptop/15.6"" HD Display/Ash Grey/1.5 kg/MS Office 2021",,,5.0 out of 5 stars,1,,,https://m.media-amazon.com/images/I/71sxKjBSHKL._AC_UY218_.jpg,,
laptop,"Cable World Educational Laptop Computer Toy Educational Computer for Kids Above 3 Years - 20 Fun Activity Learning Machine, Now Learn Letter, Words, Games, Mathematics, Music, Logic, Memory Tool,Blue",,,3.8 out of 5 stars,"3,666",,,https://m.media-amazon.com/images/I/61ERcyHgZxL._AC_UY218_.jpg,,
laptop,"Lenovo V14 G3, 12th Gen Intel Core i7-1255U Upto 4.70Ghz (16GB RAM/512GB SSD/Windows 11) 14.0"" FHD Display Thin and Light Laptop/Iron Grey /1.70 kg 1 Year Onsite Brand Warranty",,,4.0 out of 5 stars,61,,,https://m.media-amazon.com/images/I/519RoeX1P4L._AC_UY218_.jpg,,
laptop,"Lenovo {Smartchoice} Idea Tab Pro with Pen Plus|12.7"" 3K Display|144 Hz Refresh|12 GB RAM, 256 GB ROM| AI-Enabled| MediaTek Dimensity 8300|Quad JBL Speakers|10200 mAh Battery with 45 W Charger|WiFi 6e",,,4.3 out of 5 stars,234,,,https://m.media-amazon.com/images/I/71+IIjxsVsL._AC_UY218_.jpg,,
laptop,"HP 15, 13th Gen Intel Core i7-1355U (16GB DDR4, 512GB SSD) FHD, Anti-Glare, 15.6’’/39.6cm, Win11, M365 Basic(1yr)* Office 24, Silver, 1.59kg, fd0468tu, Iris Xe, FHD Camera w/Shutter, Backlit Laptop",,,3.5 out of 5 stars,18,,,https://m.media-amazon.com/images/I/71pBjVL7QtL._AC_UY218_.jpg,,
laptop,"Lenovo IdeaPad Slim 5 Intel Core Ultra 5 125H Built-in AI 14"" (35.5cm) WUXGA-OLED 400Nits Thin & Light Laptop (16GB/1TB SSD/Win 11/MSO 21/FHD+IR Cam/1Yr ADP Free/3Mon Game Pass/Grey/1.4Kg), 83DA0049IN",,,3.9 out of 5 stars,52,,,https://m.media-amazon.com/images/I/816n9hBWHEL._AC_UY218_.jpg,,
laptop,"Lenovo IdeaPad Pro 5, Intel Core Ultra 9 185H, 32GB RAM, 1TB SSD, 2.8K-OLED 400Nits 120Hz, 14""/35.5cm, Windows 11, MS Office 21, Grey, 1.4Kg, 83D2001GIN,IntelArc GPU, FHD+IRCam, AI Powered Laptop",,,4.2 out of 5 stars,141,,,https://m.media-amazon.com/images/I/81Ev2S5nrVL._AC_UY218_.jpg,,
smartphone,"Samsung Galaxy M36 5G (Serene Green, 6 GB RAM, 128 GB Storage)| Circle to Search| Google Gemini| Corning Gorilla Glass Victus+| 7.7mm Slim| AI Enhanced 50 MP OIS Triple Camera| Unmatched Nightography",,,5.0 out of 5 stars,1,,,https://m.media-amazon.com/images/I/61CK00kuV5L._AC_UY218_.jpg,"Fri, 18 Jul",
smartphone,"iQOO Z10x 5G (Ultramarine, 8GB RAM, 256GB Storage) | 6500 mAh Large Capacity Battery | Dimensity 7300 Processor | Military-Grade Durability",,,4.3 out of 5 stars,"2,051",,,https://m.media-amazon.com/images/I/61HEAjUp1tL._AC_UY218_.jpg,"Fri, 18 Jul",
smartphone,"Samsung Galaxy M05 (Mint Green, 4GB RAM, 64 GB Storage) | 50MP Dual Camera | Bigger 6.7"" HD+ Display | 5000mAh Battery | 25W Fast Charging | 2 Gen OS Upgrade & 4 Year Security Update | Without Charger",,,4.0 out of 5 stars,"4,640",,,https://m.media-amazon.com/images/I/81T3olLXpUL._AC_UY218_.jpg,"Fri, 18 Jul",
smartphone,"POCO C75 5G, Enchanted Green (4GB, 64GB)",,,4.2 out of 5 stars,151,,,https://m.media-amazon.com/images/I/61HGhIw9m2L._AC_UY218_.jpg,"Fri, 18 Jul",
smartphone,"POCO M7 5G, Satin Black (6GB, 128GB)",,,4.0 out of 5 stars,79,,,https://m.media-amazon.com/images/I/71EfJ+H1uRL._AC_UY218_.jpg,"Fri, 18 Jul",
smartphone,"realme NARZO N61 (Voyage Blue,4GB RAM+64GB Storage) 90Hz Eye Comfort Display | IP54 Dust & Water Resistance | 48-Month Fluency | Charger in The Box",,,4.0 out of 5 stars,"3,847",,,https://m.media-amazon.com/images/I/71r0Ysx+oVL._AC_UY218_.jpg,"Sat, 19 Jul",
smartphone,"realme 13 Pro 5G Smartphone 12+512GB Gold,6.7inch Screen,120HZ Curved Vision Display,5200mAh Battery,82MP Camera,Qualcomm Snapdragon 7s Gen2,ip65",,,4.4 out of 5 stars,453,,,https://m.media-amazon.com/images/I/71qSB43fP0L._AC_UY218_.jpg,,
smartphone,"Samsung Galaxy A35 5G (Awesome Navy, 8GB RAM, 256GB Storage) | Premium Glass Back | 50 MP Main Camera (OIS) | Nightography | IP67 | Corning Gorilla Glass Victus+ | sAMOLED with Vision Booster",,,4.0 out of 5 stars,"1,600",,,https://m.media-amazon.com/images/I/71qQjZc6wyL._AC_UY218_.jpg,"Fri, 18 Jul",
smartphone,"Samsung Galaxy M06 5G (Sage Green, 6GB RAM, 128 GB Storage) | MediaTek Dimensity 6300 | AnTuTu Score 422K+ | 12 5G Bands| 25W Fast Charging | 4 Gen. of OS Upgrades | Without Charger",,,3.8 out of 5 stars,"1,491",,,https://m.media-amazon.com/images/I/718tAI-i2uL._AC_UY218_.jpg,"Fri, 18 Jul",
smartphone,"OnePlus 13 | Smarter with OnePlus AI | Lifetime Display Warranty (16GB RAM, 512GB Storage Black Eclipse)",,,4.5 out of 5 stars,"1,460",,,https://m.media-amazon.com/images/I/715k0WQtg9L._AC_UY218_.jpg,"Fri, 18 Jul",
smartphone,"iQOO Neo 10R 5G (Moonknight Titanium, 12GB RAM, 256GB Storage) | Snapdragon 8s Gen 3 Processor | India's Slimmest 6400mAh Battery Smartphone | Segment's Most Stable 90FPS for 5 Hours",,,4.4 out of 5 stars,"1,850",,,https://m.media-amazon.com/images/I/610NUM9jlxL._AC_UY218_.jpg,"Fri, 18 Jul",
smartphone,"Xiaomi 15 (White, 12GB/512GB)| 50 MP Leica Triple Camera | SD 8 Elite | 1.5K CrystalRes Dynamic 1-120 Hz AMOLED | Hyper AI",,,4.4 out of 5 stars,182,,,https://m.media-amazon.com/images/I/61+unAVMvUL._AC_UY218_.jpg,"Fri, 18 Jul",
smartphone,POCO M6 Plus 5G Misty Lavender 8GB RAM 128GB ROM,,,3.9 out of 5 stars,508,,,https://m.media-amazon.com/images/I/71vkB1WIouL._AC_UY218_.jpg,"Fri, 18 Jul",
smartphone,"Samsung Galaxy M06 5G (Blazing Black, 6GB RAM, 128 GB Storage) | MediaTek Dimensity 6300 | AnTuTu Score 422K+ | 12 5G Bands | 25W Fast Charging | 4 Gen. of OS Upgrades | Without Charger",,,3.8 out of 5 stars,"1,491",,,https://m.media-amazon.com/images/I/71s6rRbgfuL._AC_UY218_.jpg,"Mon, 21 Jul",
smartphone,"Motorola Edge 50 Fusion 5G (Forest Blue, 12GB RAM, 256GB Storage)",,,4.0 out of 5 stars,"1,506",,,https://m.media-amazon.com/images/I/71ZJ6bsARtL._AC_UY218_.jpg,17 - 18 Jul,
smartphone,"HONOR 200 5G (8GB+256GB, Moonlight White) – 50MP+50MP+12MP Triple Camera with Dual OIS | 50MP Selfie | Quad-Curved AMOLED Display | AI-Powered MagicOS 9.0 | Without Charger",,,4.1 out of 5 stars,"1,696",,,https://m.media-amazon.com/images/I/71nro9DdXcL._AC_UY218_.jpg,"Fri, 18 Jul",
smartphone,"Redmi A4 5G (Sparkle Purple, 4GB RAM, 128GB Storage) | Global Debut SD 4s Gen 2 | Segment Largest 6.88in 120Hz | 50MP Dual Camera | 18W Fast Charging",,,3.9 out of 5 stars,"4,442",,,https://m.media-amazon.com/images/I/81BGKLI+cWL._AC_UY218_.jpg,"Fri, 18 Jul",
smartphone,"Redmi A3X (Midnight Black, 3GB RAM, 64GB Storage) | Premium Halo Design | 90Hz Display | Powerful Octa Core Processor",,,4.0 out of 5 stars,135,,,https://m.media-amazon.com/images/I/714GaXJHGGL._AC_UY218_.jpg,"Fri, 18 Jul",
smartphone,"Vivo Y200 5G (Desert Gold, 8GB RAM, 256GB Storage) with No Cost EMI/Additional Exchange Offers",,,4.1 out of 5 stars,"1,155",,,https://m.media-amazon.com/images/I/61Odyve0+VL._AC_UY218_.jpg,"Fri, 18 Jul",
smartphone,"Lava O3 (Glossy Blue, 3 GB RAM, 64 GB Storage) | Biggest 6.75"" HD+ Display | 13MP AI Dual Rear Camera | 5000 mAh Battery | Secure Face Unlock | Fingerprint Reader | Charger & Phone-Cover in Box",,,3.8 out of 5 stars,592,,,https://m.media-amazon.com/images/I/51K+7McXYFL._AC_UY218_.jpg,"Fri, 18 Jul",
smartphone,OnePlus Nord CE5 | MediaTek Dimensity | Massive 7100mAh Battery | Powered by OnePlus AI | 8GB + 128GB | Nexus Blue,,,,,,,https://m.media-amazon.com/images/I/613wl8JI1+L._AC_UY218_.jpg,"Fri, 18 Jul",
smartphone,OnePlus 13s | Snapdragon® 8 Elite | Best Battery Life Ever on a Compact Phone | Lifetime Display Warranty | 12GB+256GB | Green Silk,,,4.5 out of 5 stars,316,,,https://m.media-amazon.com/images/I/61BTIyv+XdL._AC_UY218_.jpg,"Fri, 18 Jul",
smartphone,"Redmi 14C 5G (Stargaze Black, 6GB RAM, 128GB Storage) | Superfast 4nm Snapdragon 4 Gen 2 | 120Hz 17.47cm (6.88”) Display | 5160mAh Battery | 50MP Dual Camera | Premium Starlight Design",,,4.0 out of 5 stars,"1,007",,,https://m.media-amazon.com/images/I/81PHUjI+raL._AC_UY218_.jpg,"Fri, 18 Jul",
smartphone,"Redmi A4 5G (Starry Black, 6GB RAM, 128GB Storage) | Global Debut SD 4s Gen 2 | Segment Largest 6.88in 120Hz | 50MP Dual Camera | 18W Fast Charging",,,3.9 out of 5 stars,"4,442",,,https://m.media-amazon.com/images/I/710SCukwhcL._AC_UY218_.jpg,"Fri, 18 Jul",
smartphone,"Samsung Galaxy A35 5G (Awesome Lilac, 8GB RAM, 128GB Storage) | Premium Glass Back | 50 MP Main Camera (OIS) | Nightography | IP67 | Corning Gorilla Glass Victus+ | sAMOLED with Vision Booster",,,4.0 out of 5 stars,"1,600",,,https://m.media-amazon.com/images/I/71ydypHebBL._AC_UY218_.jpg,"Fri, 18 Jul",
smartphone,Xiaomi 14 Civi Panda White (12GB RAM 512GB Storage) | 50 MP Leica Triple Camera| SD 8s Gen 3 | 1.5K Quad Curved AMOLED HyperOS,,,4.0 out of 5 stars,299,,,https://m.media-amazon.com/images/I/81N7XKYIzFL._AC_UY218_.jpg,"Fri, 18 Jul",
smartphone,"Motorola G05 4G (Forest Green, 4GB RAM, 64GB Storage)",,,3.9 out of 5 stars,959,,,https://m.media-amazon.com/images/I/61xBynqDfVL._AC_UY218_.jpg,"Fri, 18 Jul",
smartphone,"Lava Bold N1 (Sparkling Ivory, 4 GB RAM, 64 GB Storage)| 6.75"" (90 Hz) HD+ Display | 13MP AI Dual Rear Camera | 5000 mAh Battery | Secure Face Unlock | Fingerprint Reader | Charger & Phone-Case in Box",,,3.9 out of 5 stars,22,,,https://m.media-amazon.com/images/I/71CJizapp8L._AC_UY218_.jpg,"Fri, 18 Jul",
smartphone,"Samsung Galaxy F05 (Twilight Blue, 64 GB) (4 GB RAM)",,,4.0 out of 5 stars,172,,,https://m.media-amazon.com/images/I/71Q6eGldZVL._AC_UY218_.jpg,"Fri, 18 Jul",
smartphone,"Samsung Galaxy S24 FE 5G AI Smartphone (Graphite, 8GB RAM, 128GB Storage)",,,4.3 out of 5 stars,432,,,https://m.media-amazon.com/images/I/71eUNTW+nJL._AC_UY218_.jpg,"Fri, 18 Jul",
smartphone,"Samsung Galaxy F06 5G, Bahama Blue (4GB, 128GB)",,,3.7 out of 5 stars,133,,,https://m.media-amazon.com/images/I/41S0KJoxqBL._AC_UY218_.jpg,"Fri, 18 Jul",
smartphone,"Samsung Galaxy F16 5G, Vibing Blue (6GB, 128GB)",,,,M.R.P:,,,https://m.media-amazon.com/images/I/612kDvZl5pL._AC_UY218_.jpg,"Fri, 18 Jul",
smartphone,"Redmi A4 5G (Starry Black, 4GB RAM, 64GB Storage) | Global Debut SD 4s Gen 2 | Segment Largest 6.88in 120Hz | 50MP Dual Camera | 18W Fast Charging",,,3.9 out of 5 stars,"4,442",,,https://m.media-amazon.com/images/I/718HzJbvY1L._AC_UY218_.jpg,"Fri, 18 Jul",
smartphone,"POCO M7 5G, Ocean Blue (6GB, 128GB)",,,4.0 out of 5 stars,71,,,https://m.media-amazon.com/images/I/418EYFlH0xL._AC_UY218_.jpg,"Fri, 18 Jul",
smartphone,"POCO C71, Cool Blue (6GB, 128GB)",,,3.8 out of 5 stars,19,,,https://m.media-amazon.com/images/I/51FgDipEA3L._AC_UY218_.jpg,"Mon, 21 Jul",
