Category,Title,Brand,Price (INR),Rating,Review Count,Product Badge,Product URL,Image URL,Delivery Info,Discount
books,Deewar Mein Ek Khidki Rahti Thi । दीवार में एक खिड़की रहती थी [ साहित्य अकादमी पुरस्कार से पुरस्कृत उपन्यास ],,,4.4 out of 5 stars,Hindi Edition,,,https://m.media-amazon.com/images/I/71+oHMoJ8cL._AC_UY218_.jpg,,|
books,"You Become What You Think: Master Your Mind, Master Your LIife",,,4.5 out of 5 stars,by,,,https://m.media-amazon.com/images/I/61id5HQ7ogL._AC_UY218_.jpg,,|
books,The Mountain Is You: Transforming Self-Sabotage Into Self-Mastery (English),,259.35,4.4 out of 5 stars,by,,,https://m.media-amazon.com/images/I/61xivWmExiL._AC_UY218_.jpg,,|
books,Heart Lamp: Selected Stories | WINNER OF THE INTERNATIONAL BOOKER PRIZE 2025,,243.90,4.4 out of 5 stars,by,,,https://m.media-amazon.com/images/I/81RZcbuw5UL._AC_UY218_.jpg,,|
books,"Can We Be Strangers Again?: A moving tale of love, loyalty and the bittersweet beauty of letting go",,200.33,4.3 out of 5 stars,by,,,https://m.media-amazon.com/images/I/71zpck45b2L._AC_UY218_.jpg,,|
books,Read People Like a Book,,,4.3 out of 5 stars,by,,,https://m.media-amazon.com/images/I/71-jZgbnPrL._AC_UY218_.jpg,,|
books,The Alchemist,,219.25,4.6 out of 5 stars,by,,,https://m.media-amazon.com/images/I/617lxveUjYL._AC_UY218_.jpg,,|
books,"Meditations: Timeless Wisdom from Stoic Philosophy for Inner Peace, Self-Discipline & Mental Resilience | A Classic Self-Help Book on Personal Growth & Mindfulness",,104.82,4.4 out of 5 stars,by,,,https://m.media-amazon.com/images/I/61922ZHZ21L._AC_UY218_.jpg,,|
books,"How to Live: The Mindfulness Essentials 10-Book Box Set – A Transformative Guide to Living with Clarity, Calm, and Purpose | A Perfect Gift",,,4.8 out of 5 stars,by,,,https://m.media-amazon.com/images/I/51fygQF70DL._AC_UY218_.jpg,,|
books,Legally Yours : Every Woman's Guide to Her Legal Rights,,,4.8 out of 5 stars,by,,,https://m.media-amazon.com/images/I/71e5qwrYayL._AC_UY218_.jpg,,|
books,Mandala Art: Colouring books for Adults with tear out sheets,,,4.5 out of 5 stars,by,,,https://m.media-amazon.com/images/I/911PQcsCz8S._AC_UY218_.jpg,,|
books,The Intelligent Investor : The Definitive Book on Value Investing (Third Edition),,,4.5 out of 5 stars,by,,,https://m.media-amazon.com/images/I/71piwvkH0sL._AC_UY218_.jpg,,|
books,The Theory Of Everything,,115.55,4.5 out of 5 stars,by,,,https://m.media-amazon.com/images/I/71vfo4cJCjL._AC_UY218_.jpg,,|
books,"The Science of Self-Discipline: The Willpower, Mental Toughness and Self-Control to Resist Temptation and Achieve Your Goals",,,4.6 out of 5 stars,by,,,https://m.media-amazon.com/images/I/81A6gJs73QL._AC_UY218_.jpg,,|
books,White Nights Fyodor Dostoevsky [Premium Paperback] | A Tale of Love & Loneliness | 50 Greatest Short Stories | Short Stories of Dostoevsky | Classics Books | Literature Books | White Nights Book,,,4.8 out of 5 stars,by,,,https://m.media-amazon.com/images/I/610IfoLPhvL._AC_UY218_.jpg,,|
books,"Pack of 6 Self Help Book for Adult - How to Self Confidence, Stop Worrying, Win Friends, Subconscios Mind, Think & Grow and Art of War",,,4.5 out of 5 stars,by,,,https://m.media-amazon.com/images/I/81McNZ8w2qL._AC_UY218_.jpg,,|
books,THE GUT: Story of Our Incredible Second Brain,,,4.3 out of 5 stars,by,,,https://m.media-amazon.com/images/I/71MCifUrbCL._AC_UY218_.jpg,,|
books,"Unusual Tales from Indian Mythology | Sudha Murty’s Bestselling Series | Set of 5 Books | Stories from Mahabharata, Ramayana, & Mythical Characters | Ages 9+",,,4.7 out of 5 stars,by,,,https://m.media-amazon.com/images/I/811bNWAFSFL._AC_UY218_.jpg,,|
books,The Book of Clarity: Building Your Dream Startup Using First Principles Thinking,,212.09,4.7 out of 5 stars,by,,,https://m.media-amazon.com/images/I/51vVHA67SaL._AC_UY218_.jpg,,|
books,SPIRITUAL AWAKENING SHRI HIT PREMANAND GOVIND SHARAN JI MAHARAJ VOLUME 1 (PB 2024),,,4.9 out of 5 stars,by,,,https://m.media-amazon.com/images/I/71+SDDkSd6L._AC_UY218_.jpg,,|
books,"Rupa Publications India The Blue Umbrella, 90 Pages",,99.32,4.5 out of 5 stars,by,,,https://m.media-amazon.com/images/I/71YjdCMBmQL._AC_UY218_.jpg,"Sun, 20 Jul",|
books,"Greatest Works of William Shakespeare (Boxed Set of 10) - Hamlet,Othello,The Merchant of Venice,Macbeth,The Comedy of Errors,Romeo & Juliet,Julius Caeser,Twelfth Night,A Midsummer Night's Dream",,,4.3 out of 5 stars,by,,,https://m.media-amazon.com/images/I/81l-AtY7yBL._AC_UY218_.jpg,,|
books,You Got This: Art of Loving Yourself | Emotional wellness | Mental health | Happiness | Self-Care | Personal growth | Mindfulness | Motivational | Positive Thinking,,201.95,4.3 out of 5 stars,by,,,https://m.media-amazon.com/images/I/91g4K+FXBLL._AC_UY218_.jpg,,|
books,My Journey: Transforming Dreams into Actions,,,4.6 out of 5 stars,by,,,https://m.media-amazon.com/images/I/71VOI-r3IKL._AC_UY218_.jpg,,|
books,Metamorphosis,,,4.4 out of 5 stars,by,,,https://m.media-amazon.com/images/I/71iGbgp3GGL._AC_UY218_.jpg,,|
books,Harry Potter 1–3 Box Set: A Magical Adventure Begins,,,4.6 out of 5 stars,by,,,https://m.media-amazon.com/images/I/81E3ArTwSnL._AC_UY218_.jpg,,|
books,The Power of Your Subconscious Mind: Original Edition | Premium Paperback,,,4.4 out of 5 stars,by,,,https://m.media-amazon.com/images/I/71sBtM3Yi5L._AC_UY218_.jpg,,|
books,MEDI STUDY GO Upper Limb and Lower Limb Mind maps (Quick 5 Min Revision Tool) for MBBS,,,,by,,,https://m.media-amazon.com/images/I/41E6gZmUc+L._AC_UY218_.jpg,,|
books,"EMILY HENRY 4 BOOKS BOXSET: Beach Read, People We Meet on Vacation, Book Lovers, & Happy Place | QUEEN OF ROM-COMS AND #1 NEW YORK TIMES BESTSELLING ROMANCE AUTHOR | Best of Romance!",,,4.6 out of 5 stars,by,,,https://m.media-amazon.com/images/I/71vUGeK1hDL._AC_UY218_.jpg,,|
books,Who Will Cry When You Die?,,175.65,4.4 out of 5 stars,by,,,https://m.media-amazon.com/images/I/71yu8CAKbgL._AC_UY218_.jpg,,|
books,101 Tales The Great Panchatantra Collection - Collection of Witty Moral Stories For Kids For Personality Development (Hardback),,,4.5 out of 5 stars,by,,,https://m.media-amazon.com/images/I/71My1M0AgZL._AC_UY218_.jpg,,|
books,The Monk Who Sold His Ferrari,,198.25,4.5 out of 5 stars,by,,,https://m.media-amazon.com/images/I/61pZyTuNDYL._AC_UY218_.jpg,,|
books,The Commonsense Diet: Stop Overthinking Start Eating,,191.05,4.5 out of 5 stars,by,,,https://m.media-amazon.com/images/I/71Vm0TWo3GL._AC_UY218_.jpg,,|
books,Rich Dad Poor Dad: What the Rich Teach Their Kids About Money That the Poor and Middle Class Do Not!,,367.40,4.6 out of 5 stars,by,,,https://m.media-amazon.com/images/I/81BE7eeKzAL._AC_UY218_.jpg,,|
books,The Compound Effect (English),,223.40,4.6 out of 5 stars,by,,,https://m.media-amazon.com/images/I/71nAPgrH3aL._AC_UY218_.jpg,,|
books,"Story Books for Kids (Set of 10 Books) - Mythology Stories for Children - Ganesha, Krishna, Hanuman, Ramayana, Shiva, Lakshmi, Saraswati, Durga, Mahabharata, Brahma - English Short Stories - Read Aloud to Infants, Toddlers",,89..76,,by,,,https://m.media-amazon.com/images/I/81w-2jGtGYL._AC_UY218_.jpg,,|
books,Legally Yours : Every Woman's Guide to Her Legal Rights,,,4.8 out of 5 stars,by,,,https://m.media-amazon.com/images/I/71e5qwrYayL._AC_UY218_.jpg,,|
books,The Hobbit & The Lord of the Rings Boxed Set,,,4.6 out of 5 stars,by,,,https://m.media-amazon.com/images/I/71zHQyBdhoL._AC_UY218_.jpg,,|
books,The Subtle Art of Not Giving a F*ck: A Counterintuitive Approach to Living a Good Life (Mark Manson Collection Book 1),,318..25,4.5 out of 5 stars,by,,,https://m.media-amazon.com/images/I/71QKQ9mwV7L._AC_UY218_.jpg,,|
books,MTG International Mathematics Olympiad (IMO) Workbook Class 4 - Chapterwise Previous Year Solved Paper & Achievers Section - SOF Olympiad Books For 2025-26 Exam,,,4.8 out of 5 stars,by,,,https://m.media-amazon.com/images/I/718jBDRJ6pL._AC_UY218_.jpg,,|
books,"Boy, The Mole, The Fox and The Horse, Th",,742.75,4.7 out of 5 stars,by,,,https://m.media-amazon.com/images/I/81PdkxXJObL._AC_UY218_.jpg,,|
books,Tuesdays With Morrie: The most uplifting book ever written about the importance of human connection,,215..65,4.6 out of 5 stars,by,,,https://m.media-amazon.com/images/I/81c++Bb14PL._AC_UY218_.jpg,,|
books,Macmillan - CAIIB 2025 Exam Edition - ABM + BFM + Adv. Business & Financial Mgmt + BRBL - by IIBF - Combo Set of 4 Books Bundle - Revised for 2025 Exams,,,4.3 out of 5 stars,by,,,https://m.media-amazon.com/images/I/81RCuVqVRQL._AC_UY218_.jpg,,|
books,World’s Greatest Guides to Wealth & Success: 4 Must Read Books Boxset | The Power of Your Subconscious Mind | How to Win Friends and Influence People | Think and Grow Rich | Richest Man in Babylon,,,4.7 out of 5 stars,by,,,https://m.media-amazon.com/images/I/81+72Eg1fKL._AC_UY218_.jpg,,|
books,amazon basics Mandala Coloring Book for Adults | Relaxation and Creativity | Tear-Out Sheets Included (Dahlia),,,4.7 out of 5 stars,"8,778",,,https://m.media-amazon.com/images/I/813BbALyi1L._AC_UY218_.jpg,,
books,The Egyptian Book of the Dead (Deluxe Hardbound Edition),,,3.9 out of 5 stars,by,,,https://m.media-amazon.com/images/I/71w3hPNmAgL._AC_UY218_.jpg,,|
books,"The Ultimate Rumi Collection (Boxset of 3 Books) : Essential Rumi, Rumi: Bridge to the Soul, Rumi : The Book of Love",,,4.6 out of 5 stars,by,,,https://m.media-amazon.com/images/I/810iR1VTnVL._AC_UY218_.jpg,,|
books,The Mighty Tiny Tales of Gyatso and Tashi,,,5.0 out of 5 stars,by,,,https://m.media-amazon.com/images/I/81OiqDAQ4aL._AC_UY218_.jpg,,|
